Name,Year,Languages,Countries,Genres,Budget,runtime,rating,domestic_gross,foreign_gross,worldwide_gross
Beauty and the Beast ,2017,English,United States,Musical,"$160,000,000 (worldwide box office is 7.9 times production budget)",123 minutes,"PG for some action violence, peril and frightening images.(Rating bulletin 2445 (Cert #50712), 10/5/2016)","$504,014,165","$764,683,318","$1,268,697,483"
Spider-Man: Far From Home ,2019,English,United States,Action,"$160,000,000 (worldwide box office is 7.1 times production budget)",129 minutes,"PG-13 for sci-fi action violence, some language and brief suggestive comments.(Rating bulletin 2582 (Cert #51941), 6/12/2019)PG-13 NOTE: EDITED VERSION. CONTENT IS DIFFERENT FROM ""PG-13"" RATED VERSION, BULLETIN NO. 2582 (6/12/2019).(Rating bulletin 2593 (Cert #52353), 8/28/2019)","$391,362,492","$740,936,182","$1,132,298,674"
Aquaman ,2018,English,United States,Action,"$160,000,000 (worldwide box office is 7.1 times production budget)",143 minutes,"PG-13 for sequences of sci-fi violence and action, and for some language.(Rating bulletin 2543 (Cert #51796), 9/5/2018)","$335,061,807","$796,787,895","$1,131,849,702"
Shrek the Third ,2007,English,United States,Adventure,"$160,000,000 (worldwide box office is 5.0 times production budget)",92 minutes,"PG for some crude humor, suggestive content and swashbuckling action","$322,719,944","$484,610,992","$807,330,936"
Inception ,2010,"English, French, Japanese","United Kingdom, United States",Thriller/Suspense,"$160,000,000 (worldwide box office is 5.2 times production budget)",147 minutes,"PG-13 for sequences of violence and action throughout(Rating bulletin 2118, 4/28/2010)","$292,576,195","$533,210,699","$825,786,894"
The Hunger Games: Mockingjay - Part 2 ,2015,English,United States,Action,"$160,000,000 (worldwide box office is 4.0 times production budget)",136 minutes,"PG-13 for intense sequences of violence and action, and for some thematic material.(Rating bulletin 2387, 8/19/2015)","$281,723,902","$364,496,052","$646,219,954"
Fast and Furious 6 ,2013,English,United States,Action,"$160,000,000 (worldwide box office is 4.9 times production budget)",130 minutes,"PG-13 for intense sequences of violence and action and mayhem throughout, some sexuality and language.(Rating bulletin 2270, 5/1/2013)","$238,679,850","$550,620,594","$789,300,444"
Godzilla ,2014,English,United States,Action,"$160,000,000 (worldwide box office is 3.3 times production budget)",123 minutes,"PG-13 for intense sequences of destruction, mayhem and creature violence.(Rating bulletin 2317, 4/9/2014)","$200,676,069","$328,400,000","$529,076,069"
Kingdom of the Planet of the Apes ,2024,English,United States,Action,"$160,000,000 (worldwide box office is 2.5 times production budget)",145 minutes,"PG-13 for intense sequences of sci-fi violence/action.(Rating bulletin 2829 (cert #54356), 4/10/2024)","$171,130,165","$226,239,804","$397,369,969"
X-Men: First Class ,2011,English,"United Kingdom, United States",Action,"$160,000,000 (worldwide box office is 2.2 times production budget)",132 minutes,"PG-13 for intense sequences of action and violence, some sexual content including brief partial nudity and language.(Rating bulletin 2171, 5/11/2011)","$146,408,305","$209,000,000","$355,408,305"
The Curious Case of Benjamin Button ,2008,English,United States,Drama,"$160,000,000 (worldwide box office is 2.1 times production budget)",167 minutes,"PG-13 for brief war violence, sexual content, language and smoking","$127,509,326","$202,122,632","$329,631,958"
