Name,Year,Languages,Countries,Genres,Budget,runtime,rating,domestic_gross,foreign_gross,worldwide_gross
Stone Cold ,1991,English,United States,Action,"$25,000,000 (worldwide box office is 0.4 times production budget)",95 minutes,"R for strong violence and language, and for sensuality.","$9,286,314",,
Serenity ,2019,English,United States,Thriller/Suspense,"$25,000,000 (worldwide box office is 0.5 times production budget)",103 minutes,"R for language throughout, sexual content, and some bloody images.(Rating bulletin 2544 (Cert #51662), 9/12/2018)","$8,547,045","$4,461,759","$13,008,804"
The Road ,2009,English,United States,Drama,"$25,000,000 (worldwide box office is 1.2 times production budget)",111 minutes,"R For some violence, disturbing images and language","$8,114,270","$21,092,462","$29,206,732"
Beautiful Boy ,2018,English,United States,Drama,"$25,000,000 (worldwide box office is 0.7 times production budget)",112 minutes,"R for drug content throughout, language, and brief sexual material.(Rating bulletin 2519 (Cert #51526), 3/21/2018)","$7,634,767","$9,691,265","$17,326,032"
The Hoax ,2007,English,United Kingdom,Comedy,"$25,000,000 (worldwide box office is 0.3 times production budget)",116 minutes,R for language.,"$7,164,995",,
A Journal for Jordan ,2021,English,United States,Drama,"$25,000,000 (worldwide box office is 0.3 times production budget)",131 minutes,"PG-13 for some sexual content, partial nudity, drug use and language.(Rating bulletin 2708 (cert #53045), 11/24/2021)","$6,545,174","$137,511","$6,682,685"
Captive State ,2019,English,United States,Thriller/Suspense,"$25,000,000 (worldwide box office is 0.4 times production budget)",109 minutes,"PG-13 for sci-fi violence and action, some sexual content, brief language and drug material.(Rating bulletin 2521 (Cert #51540), 4/4/2018)","$5,958,315","$3,404,895","$9,363,210"
Sheena ,1984,English,"United Kingdom, United States",Adventure,"$25,000,000 (worldwide box office is 0.2 times production budget)",117 minutes,,"$5,778,353",,
Suburbicon ,2017,English,United States,Black Comedy,"$25,000,000 (worldwide box office is 0.6 times production budget)",105 minutes,"R for violence, language and some sexuality.(Rating bulletin 2476 (Cert #51059), 5/17/2017)","$5,775,178","$9,746,441","$15,521,619"
Underclassman ,2005,English,United States,Comedy,"$25,000,000 (worldwide box office is 0.2 times production budget)",95 minutes,"PG-13 for violence, sexual references, drug material and some teen drinking.","$5,654,777",,
Say It Isn't So ,2001,,United States,Black Comedy,"$25,000,000 (worldwide box office is 0.2 times production budget)",95 minutes,"R for strong sexual content, crude humor and language","$5,516,708",,
The World's Fastest Indian ,2005,English,"New Zealand, United States",Drama,"$25,000,000 (worldwide box office is 0.8 times production budget)",127 minutes,"PG-13 for brief language, drug use and a sexual reference.","$5,128,124","$13,863,164","$18,991,288"
Deception ,2008,English,United States,Thriller/Suspense,"$25,000,000 (worldwide box office is 0.5 times production budget)",108 minutes,"R for sexual content, language, brief violence and some drug use.","$4,598,506","$8,251,527","$12,850,033"
Tank Girl ,1995,English,United States,Action,"$25,000,000 (worldwide box office is 0.2 times production budget)",104 minutes,"R for violence, language and sexuality","$4,064,333",,
King's Ransom ,2005,,United States,Black Comedy,"$25,000,000 (worldwide box office is 0.2 times production budget)",95 minutes,PG-13 for crude and sexual humor and language.,"$4,008,527","$41,000","$4,049,527"
Bill & Ted Face the Music ,2020,English,United States,Comedy,"$25,000,000 (worldwide box office is 0.3 times production budget)",91 minutes,"PG-13 for some language.(Rating bulletin 2636 (Cert #52761), 7/1/2020)","$3,439,660","$2,815,970","$6,255,630"
Blindness ,2008,English,"Brazil, Canada, Japan",Thriller/Suspense,"$25,000,000 (worldwide box office is 0.8 times production budget)",121 minutes,"R for violence including sexual assaults, language and sexuality/nudity.","$3,073,392","$16,979,566","$20,052,958"
Sgt. Stubby: An American Hero ,2018,English,"Canada, France, United States",Adventure,"$25,000,000 (worldwide box office is 0.2 times production budget)",84 minutes,"PG for war action and some thematic elements.(Rating bulletin 2518 (Cert #51509), 3/14/2018)","$3,054,285","$769,335","$3,823,620"
Carnage ,2011,English,"France, Germany, Poland, Spain",Black Comedy,"$25,000,000 (worldwide box office is 1.5 times production budget)",79 minutes,"R for language.(Rating bulletin 2191, 9/28/2011)","$2,546,747","$35,565,407","$38,112,154"
Tulip Fever ,2017,English,"United Kingdom, United States",Drama,"$25,000,000 (worldwide box office is 0.3 times production budget)",105 minutes,"R for sexual content and nudity.(Rating bulletin 2476 (Cert #50293), 5/17/2017)","$2,455,635","$4,337,133","$6,792,768"
BloodRayne ,2006,English,"Romania, United Kingdom",Action,"$25,000,000 (worldwide box office is 0.1 times production budget)",92 minutes,"R for strong bloody violence, some sexuality and nudity.","$2,405,420","$1,306,213","$3,711,633"
Legend ,2015,English,United Kingdom,Thriller/Suspense,"$25,000,000 (worldwide box office is 1.7 times production budget)",131 minutes,"R for strong violence, language throughout, some sexual and drug material.(Rating bulletin 2377, 6/10/2015)","$1,872,994","$40,407,450","$42,280,444"
Bad Lieutenant: Port of Call New Orleans ,2009,English,United States,Drama,"$25,000,000 (worldwide box office is 0.5 times production budget)",122 minutes,"R for drug use and language throughout, some violence and sexuality","$1,702,112","$10,711,837","$12,413,949"
Jane Got a Gun ,2015,English,United States,Western,"$25,000,000 (worldwide box office is 0.2 times production budget)",98 minutes,"R for violence and some language.(Rating bulletin 2405 (Cert #49540), 12/23/2015)","$1,513,793","$2,257,552","$3,771,345"
Me and Orson Welles ,2009,English,United Kingdom,Drama,"$25,000,000 (worldwide box office is 0.0 times production budget)",113 minutes,PG-13 For sexual references and smoking,"$1,190,003",,
All My Life ,2020,English,United States,Drama,"$25,000,000 (worldwide box office is 0.1 times production budget)",91 minutes,"PG-13 for brief language.(Rating bulletin 2643 (Cert #52855), 8/19/2020)","$913,935","$1,110,128","$2,024,063"
Venom ,2005,"Creole, English",United States,Horror,"$25,000,000 (worldwide box office is 0.0 times production budget)",87 minutes,"R for strong horror violence/gore, and language.","$881,745",,
Where the Truth Lies ,2005,,Canada,Drama,"$25,000,000 (worldwide box office is 0.1 times production budget)",108 minutes,"Not Rated (originally rated NC-17, rating surrendered)","$872,142","$543,514","$1,415,656"
Without Limits ,1998,,,Drama,"$25,000,000 (worldwide box office is 0.0 times production budget)",,PG-13 for brief sexual material and brief strong language. ,"$780,326",,
On the Road ,2012,English,"Brazil, France",Drama,"$25,000,000 (worldwide box office is 0.4 times production budget)",125 minutes,"R for strong sexual content, drug use and language.(Rating bulletin 2240, 9/11/2012)","$720,828","$8,592,474","$9,313,302"
Les petits mouchoirs ,2012,French,France,Comedy,"$25,000,000 (worldwide box office is 1.9 times production budget)",154 minutes,Not Rated,"$205,505","$48,325,382","$48,530,887"
Love Ranch ,2010,,United States,Drama,"$25,000,000 (worldwide box office is 0.0 times production budget)",118 minutes,"R for sexual content, pervasive language and some violence(Rating bulletin 2124, 6/9/2010)","$137,885","$8,264","$146,149"
Yi ge ren de wu lin ,2015,"Cantonese, Mandarin","China, Hong Kong",Action,"$25,000,000 (worldwide box office is 0.0 times production budget)",100 minutes,Not Rated,"$129,115",,
Mutant Chronicles ,2009,English,United States,Action,"$25,000,000 (worldwide box office is 0.0 times production budget)",111 minutes,R for strong bloody violence and language throughout,"$6,820",,
Sammy's avonturen: De geheime doorgang ,2010,English,"Belgium, France",Adventure,"$25,000,000 (worldwide box office is 2.9 times production budget)",86 minutes,"PG for mild peril.(Rating bulletin 2209, 2/8/2012)",n/a,"$71,594,792","$71,594,792"
Matilda ,1996,Russian,Russian Federation,Drama,"$25,000,000 (worldwide box office is 0.4 times production budget)",130 minutes,,n/a,"$9,755,282","$9,755,282"
Belka i Strelka. Zvezdnye sobaki ,2010,Russian,Russian Federation,Adventure,"$25,000,000 (worldwide box office is 0.4 times production budget)",85 minutes,"G(Rating bulletin 2144, 10/27/2010)",n/a,"$9,445,081","$9,445,081"
La véritable histoire du Chat Botté ,2011,French,"Belgium, France, Switzerland",,"$25,000,000 (worldwide box office is 0.3 times production budget)",,"G(Rating bulletin 2171, 5/11/2011)G(Rated 10/1/2011)",n/a,"$8,208,594","$8,208,594"
The Professor and the Madman ,2019,English,"France, Iceland, Ireland, United States",Drama,"$25,000,000 (worldwide box office is 0.3 times production budget)",125 minutes,,n/a,"$6,353,847","$6,353,847"
Ironclad ,2011,English,"United Kingdom, United States",Action,"$25,000,000 (worldwide box office is 0.2 times production budget)",120 minutes,"R for strong graphic brutal battle sequences, and brief nudity.(Rating bulletin 2164, 3/23/2011)",n/a,"$5,297,411","$5,297,411"
Red Sky ,2014,English,United States,Action,"$25,000,000 (worldwide box office is 0.0 times production budget)",108 minutes,"PG-13 for combat violence, sexual material and brief strong language.(Rating bulletin 2314, 3/19/2014)",n/a,"$91,116","$91,116"
Waterloo ,1970,English,"Italy, USSR",,"$25,000,000",134 minutes,,n/a,,
The Adventurer: The Curse of the Midas Box ,2014,English,United Kingdom,Adventure,"$25,000,000",98 minutes,"PG for adventure action and violence, some peril and brief smoking.(Rating bulletin 2289, 9/11/2013)",n/a,,
Mandate ,Announced,English,United States,Action,"$25,000,000",,,n/a,,
Dangerous Liaisons ,2012,Mandarin,China,Drama,"$24,200,000 (worldwide box office is 0.4 times production budget)",110 minutes,Not Rated,"$17,000","$10,430,579","$10,447,579"
Star Trek IV: The Voyage Home ,1986,English,United States,Adventure,"$24,000,000 (worldwide box office is 5.5 times production budget)",122 minutes,PG,"$109,713,132","$23,286,868","$133,000,000"
Scream 2 ,1997,English,United States,Horror,"$24,000,000 (worldwide box office is 7.2 times production budget)",120 minutes,R for language and strong bloody violence,"$101,363,301","$71,000,000","$172,363,301"
The Addams Family ,2019,English,United States,Adventure,"$24,000,000 (worldwide box office is 8.4 times production budget)",100 minutes,"PG for macabre and suggestive humor, and some action.(Rating bulletin 2593 (Cert #52356), 8/28/2019)","$97,864,733","$102,723,813","$200,588,546"
Where the Crawdads Sing ,2022,English,United States,Drama,"$24,000,000 (worldwide box office is 6.0 times production budget)",125 minutes,"PG-13 for sexual content and some violence including a sexual assault.(Rating bulletin 2739 (cert #53621), 7/6/2022)","$90,230,760","$54,123,205","$144,353,965"
Scream ,2022,English,United States,Horror,"$24,000,000 (worldwide box office is 5.8 times production budget)",114 minutes,"R for strong bloody violence, language throughout and some sexual references.(Rating bulletin 2709 (cert #53115), 12/1/2021)","$81,641,405","$57,233,384","$138,874,789"
Old School ,2003,English,United States,Comedy,"$24,000,000 (worldwide box office is 3.6 times production budget)",90 minutes,"R for some strong sexual content, nudity and language","$75,155,000","$11,582,464","$86,737,464"
Rocky Balboa ,2006,English,United States,Drama,"$24,000,000 (worldwide box office is 6.5 times production budget)",101 minutes,PG for boxing violence and some language.,"$70,269,899","$85,959,151","$156,229,050"
Think Like a Man Too ,2014,English,United States,Romantic Comedy,"$24,000,000 (worldwide box office is 2.9 times production budget)",105 minutes,"PG-13 for crude sexual content including references, partial nudity, language and drug material.(Rating bulletin 2313, 3/12/2014)","$65,028,687","$4,999,246","$70,027,933"
Fences ,2016,English,United States,Drama,"$24,000,000 (worldwide box office is 2.7 times production budget)",133 minutes,"PG-13 for thematic elements, language and some suggestive references.(Rating bulletin 2453 (Cert #50721), 11/30/2016)","$57,682,904","$6,599,977","$64,282,881"
The Whole Nine Yards ,2000,English,"Canada, United States",Comedy,"$24,000,000 (worldwide box office is 3.6 times production budget)",98 minutes,R for some sexuality/nudity and violence,"$57,262,492","$28,265,375","$85,527,867"
Footloose ,2011,English,United States,Drama,"$24,000,000 (worldwide box office is 2.6 times production budget)",113 minutes,"PG-13 for some teen drug and alcohol use, sexual content, violence and language.(Rating bulletin 2192, 10/5/2011)","$51,802,742","$11,187,092","$62,989,834"
Going in Style ,2017,English,United States,Comedy,"$24,000,000 (worldwide box office is 3.4 times production budget)",96 minutes,"PG-13 for drug content, language and some suggestive material.(Rating bulletin 2423 (Cert #50396), 5/4/2016)","$45,018,541","$35,793,883","$80,812,424"
Point Break ,1991,English,United States,Action,"$24,000,000 (worldwide box office is 3.5 times production budget)",120 minutes,"R for violence, language and brief nudity","$43,218,387","$40,313,571","$83,531,958"
The Fisher King ,1991,English,United States,Drama,"$24,000,000 (worldwide box office is 1.7 times production budget)",,R for language and violence.,"$41,798,224",,
I Still Know What You Did Last Summer ,1998,,United States,Horror,"$24,000,000 (worldwide box office is 1.7 times production budget)",,"R for intense terror violence and gore, strong language and some drug use","$40,020,622",,
Hitman ,2007,English,"France, United States",Action,"$24,000,000 (worldwide box office is 4.1 times production budget)",95 minutes,"R for strong bloody violence, language and some sexuality/nudity.","$39,687,694","$59,447,877","$99,135,571"
"Hello, Dolly ",1969,English,United States,Musical,"$24,000,000 (worldwide box office is 1.4 times production budget)",146 minutes,G,"$33,208,099",$114,"$33,208,213"
Return to Me ,2000,,United States,Romantic Comedy,"$24,000,000 (worldwide box office is 1.4 times production budget)",,PG for language and thematic elements,"$32,662,299",,
The Men Who Stare at Goats ,2009,English,United States,Black Comedy,"$24,000,000 (worldwide box office is 2.8 times production budget)",94 minutes,"R For language, some drug content and brief nudity","$32,428,195","$34,920,023","$67,348,218"
Zack and Miri Make a Porno ,2008,English,United States,Comedy,"$24,000,000 (worldwide box office is 1.5 times production budget)",101 minutes,"R for Appeal for strong crude sexual content including dialogue, graphic nudity and pervasive language","$31,457,946","$5,398,360","$36,856,306"
Double Take ,2001,English,United States,Action,"$24,000,000 (worldwide box office is 1.2 times production budget)",88 minutes,PG-13 for violence and language,"$29,823,162",,
"Girl, Interrupted ",1999,English,"Germany, United States",Drama,"$24,000,000 (worldwide box office is 2.0 times production budget)",127 minutes,"R for strong language and content relating to drugs, sexuality and suicide","$28,871,190","$19,437,559","$48,308,749"
Nurse Betty ,2000,English,United States,Black Comedy,"$24,000,000 (worldwide box office is 1.2 times production budget)",110 minutes,"R for strong violence, pervasive language and a scene of sexuality","$25,170,054","$2,562,312","$27,732,366"
Piranha 3D ,2010,English,United States,Horror,"$24,000,000 (worldwide box office is 3.5 times production budget)",88 minutes,"R for sequences of strong bloody horror violence and gore, graphic nudity, sexual content, language and some drug use.(Rating bulletin 2133, 8/11/2010)","$25,003,155","$58,657,005","$83,660,160"
Faster ,2010,English,United States,Action,"$24,000,000 (worldwide box office is 1.5 times production budget)",98 minutes,"R for strong violence, some drug use and language.(Rating bulletin 2135, 8/18/2010)","$23,240,020","$12,552,925","$35,792,945"
Lock Up ,1989,,United States,Action,"$24,000,000 (worldwide box office is 0.9 times production budget)",100 minutes,R,"$22,099,847",,
The Wiz ,1978,English,United States,Musical,"$24,000,000 (worldwide box office is 0.9 times production budget)",134 minutes,G,"$22,000,000",,
Win a Date with Tad Hamilton! ,2004,English,United States,Romantic Comedy,"$24,000,000 (worldwide box office is 0.7 times production budget)",96 minutes,PG-13,"$16,980,098","$609,731","$17,589,829"
Muppets From Space ,1999,English,United States,Adventure,"$24,000,000 (worldwide box office is 0.7 times production budget)",87 minutes,G,"$16,304,786",,
Ready to Rumble ,2000,,United States,Comedy,"$24,000,000 (worldwide box office is 0.5 times production budget)",107 minutes,"PG-13 for language, crude humor, sexual content including brief nudity, and wrestling violence","$12,372,410",,
Foxcatcher ,2014,English,United States,Drama,"$24,000,000 (worldwide box office is 0.8 times production budget)",134 minutes,"R for some drug use and a scene of violence.(Rating bulletin 2326, 6/11/2014)","$12,096,300","$7,206,758","$19,303,058"
I Don't Know How She Does It ,2011,English,United States,Comedy,"$24,000,000 (worldwide box office is 1.0 times production budget)",89 minutes,"PG-13 for sexual references throughout.(Rating bulletin 2189, 9/14/2011)","$9,659,074","$14,815,389","$24,474,463"
Play it to the Bone ,1999,English,United States,Comedy,"$24,000,000 (worldwide box office is 0.4 times production budget)",124 minutes,"R for brutal ring violence, strong sexuality including dialogue, nudity, pervasive language and some drug content","$8,427,204",,
Dhoom 3 ,2013,Hindi,India,Action,"$24,000,000 (worldwide box office is 0.5 times production budget)",150 minutes,Not Rated,"$8,031,955","$3,691,665","$11,723,620"
Hauru no ugoku shiro ,2005,Japanese,Japan,Adventure,"$24,000,000 (worldwide box office is 10.0 times production budget)",119 minutes,PG for frightening images and brief mild language.,"$7,095,145","$232,767,471","$239,862,616"
Beyond the Sea ,2004,,,Drama,"$24,000,000 (worldwide box office is 0.3 times production budget)",118 minutes,PG-13 for some strong language and a scene of sensuality.,"$6,144,806","$2,148,108","$8,292,914"
Meet the Deedles ,1998,English,United States,Comedy,"$24,000,000 (worldwide box office is 0.2 times production budget)",93 minutes,"PG for language, violence and crude humor","$4,356,126",,
The Thief and the Cobbler ,1995,English,United Kingdom,Adventure,"$24,000,000 (worldwide box office is 0.0 times production budget)",90 minutes,G,"$669,276",,
The Bridge of San Luis Rey ,2005,,,Drama,"$24,000,000 (worldwide box office is 0.1 times production budget)",,"PG for thematic elements, some disturbing images and some sensuality.","$49,981","$1,646,784","$1,696,765"
Flood ,2007,English,"Canada, South Africa, United Kingdom",,"$24,000,000 (worldwide box office is 0.2 times production budget)",,,n/a,"$4,084,232","$4,084,232"
Annaatthe ,2021,"Tamil, Telugu",India,Drama,"$24,000,000 (worldwide box office is 0.0 times production budget)",163 minutes,,n/a,"$447,432","$447,432"
Zombieland ,2009,English,United States,Comedy,"$23,600,000 (worldwide box office is 4.3 times production budget)",87 minutes,R for zombie horror violence/gore and language.,"$75,590,286","$26,646,310","$102,236,596"
Star Wars Ep. V: The Empire Strikes Back ,1980,English,United States,Adventure,"$23,000,000 (worldwide box office is 23.9 times production budget)",124 minutes,PG for sci-fi action violence.,"$291,738,960","$257,262,126","$549,001,086"
The Waterboy ,1998,English,United States,Comedy,"$23,000,000 (worldwide box office is 8.3 times production budget)",88 minutes,PG-13 for language and some crude sexual humor.,"$161,491,646","$28,700,000","$190,191,646"
The Naked Gun 2½: The Smell of Fear ,1991,English,United States,Comedy,"$23,000,000 (worldwide box office is 3.8 times production budget)",,PG-13,"$86,930,411",,
Green Book ,2018,English,United States,Comedy,"$23,000,000 (worldwide box office is 13.9 times production budget)",130 minutes,"PG-13 for thematic content, language including racial epithets, smoking, some violence and suggestive material.(Rating bulletin 2528 (Cert #51410), 5/23/2018)","$85,080,171","$234,914,848","$319,995,019"
Dangerous Minds ,1995,"English, Spanish",United States,Drama,"$23,000,000 (worldwide box office is 7.8 times production budget)",99 minutes,R for language.,"$84,919,401","$94,000,000","$178,919,401"
Bad Boys ,1995,,United States,Action,"$23,000,000 (worldwide box office is 6.1 times production budget)",106 minutes,R for intense violent action and pervasive strong language,"$65,647,413","$75,600,000","$141,247,413"
The Wedding Ringer ,2015,English,United States,Comedy,"$23,000,000 (worldwide box office is 3.5 times production budget)",101 minutes,"R for crude and sexual content, language throughout, some drug use and brief graphic nudity.(Rating bulletin 2354, 12/24/2014)","$64,460,211","$15,711,385","$80,171,596"
Final Destination ,2000,English,United States,Horror,"$23,000,000 (worldwide box office is 4.9 times production budget)",97 minutes,"R for violence and terror, and for language","$53,302,314","$58,734,556","$112,036,870"
King Kong ,1976,English,United States,Action,"$23,000,000 (worldwide box office is 3.9 times production budget)",134 minutes,PG,"$52,614,445","$38,000,000","$90,614,445"
The Crow ,1994,English,United States,Action,"$23,000,000 (worldwide box office is 2.3 times production budget)",102 minutes,"R for a great amount of strong violence and language, and for drug use and some sexuality.","$50,638,075","$1,657,655","$52,295,730"
The Ides of March ,2011,English,United States,Drama,"$23,000,000 (worldwide box office is 3.4 times production budget)",101 minutes,"R for pervasive language.(Rating bulletin 2186, 8/26/2011)","$40,962,534","$36,773,391","$77,735,925"
Pitch Black ,2000,English,Australia,Horror,"$23,000,000 (worldwide box office is 2.3 times production budget)",107 minutes,"R for sci-fi violence and gore, and for language","$39,235,088","$13,947,000","$53,182,088"
The Hate U Give ,2018,English,United States,Drama,"$23,000,000 (worldwide box office is 1.5 times production budget)",133 minutes,"PG-13 for mature thematic elements, some violent content, drug material and language.(Rating bulletin 2533 (Cert #51652), 6/27/2018)","$29,719,483","$5,348,182","$35,067,665"
