Name,Year,Languages,Countries,Genres,Budget,runtime,rating,domestic_gross,foreign_gross,worldwide_gross
Volcano ,1997,English,United States,Action,"$90,000,000 (worldwide box office is 1.3 times production budget)",102 minutes,PG-13 for intense depiction of urban disaster and related injuries,"$47,546,796","$72,553,204","$120,100,000"
Death on the Nile ,2022,English,United States,Drama,"$90,000,000 (worldwide box office is 1.4 times production budget)",127 minutes,"PG-13 for violence, some bloody images, and sexual material.(Rating bulletin 2713 (cert #52577), 1/5/2022)","$45,630,104","$84,668,080","$130,298,184"
The Devil's Own ,1997,English,United States,Thriller/Suspense,"$90,000,000 (worldwide box office is 1.6 times production budget)",107 minutes,"R for strong brutal violence, and for language","$42,885,593","$98,014,407","$140,900,000"
K-19: The Widowmaker ,2002,English,United Kingdom,Action,"$90,000,000 (worldwide box office is 0.7 times production budget)",138 minutes,PG-13,"$35,168,966","$30,547,160","$65,716,126"
Conan the Barbarian ,2011,English,United States,Action,"$90,000,000 (worldwide box office is 0.7 times production budget)",112 minutes,"R for strong bloody violence, some sexuality and nudity.(Rating bulletin 2177, 6/22/2011)","$21,295,021","$42,061,112","$63,356,133"
The Three Musketeers ,2011,English,"France, Germany, United Kingdom, United States",Adventure,"$90,000,000 (worldwide box office is 1.6 times production budget)",102 minutes,"PG-13 for sequences of adventure action violence.(Rating bulletin 2178, 6/29/2011)","$20,377,913","$119,500,000","$139,877,913"
